[
  {
    "name": "mysql",
    "category": "Storage",
    "displayName": "MySQL 数据库",
    "description": "MySQL 数据库",
    "plans": [{"name": "default", "providerType": "user-defined", "config": {}}]
  },
  {
    "name": "polaris",
    "category": "Network",
    "displayName": "北极星",
    "description": "北极星服务",
    "plans": [{"name": "default", "providerType": "system-allocated", "config": {"baseUrl": "https://polaris.example.com"}}]
  },
  {
    "name": "fake",
    "category": "Test",
    "displayName": "Fake 服务（仅测试）",
    "description": "仅用于测试的 fake 服务，不应在生产流量中使用",
    "plans": [{"name": "default", "providerType": "user-defined", "config": {}}]
  }
]
